    448 11.531307      127.0.0.1             127.0.0.1             TCP      73     54176 → 3950 [PSH, ACK] Seq=1 Ack=1 Win=408288 Len=17 TSval=1808742212 TSecr=1808742211
0000  49 5f 41 4d 5f 44 45 50 41 52 54 4d 45 4e 54 23   I_AM_DEPARTMENT#
0010  43                                                C
    449 11.531307      127.0.0.1             127.0.0.1             TCP      73     54177 → 3950 [PSH, ACK] Seq=1 Ack=1 Win=408288 Len=17 TSval=1808742212 TSecr=1808742211
0000  49 5f 41 4d 5f 44 45 50 41 52 54 4d 45 4e 54 23   I_AM_DEPARTMENT#
0010  42                                                B
    452 11.531359      127.0.0.1             127.0.0.1             TCP      73     54175 → 3950 [PSH, ACK] Seq=1 Ack=1 Win=408288 Len=17 TSval=1808742212 TSecr=1808742210
0000  49 5f 41 4d 5f 44 45 50 41 52 54 4d 45 4e 54 23   I_AM_DEPARTMENT#
0010  41                                                A
    454 11.531458      127.0.0.1             127.0.0.1             TCP      66     3950 → 54175 [PSH, ACK] Seq=1 Ack=18 Win=408256 Len=10 TSval=1808742212 TSecr=1808742212
0000  41 44 4d 5f 49 5f 52 43 47 5a                     ADM_I_RCGZ
    456 11.531489      127.0.0.1             127.0.0.1             TCP      62     54175 → 3950 [PSH, ACK] Seq=18 Ack=11 Win=408288 Len=6 TSval=1808742212 TSecr=1808742212
0000  41 31 23 33 2e 36                                 A1#3.6
    458 11.532611      127.0.0.1             127.0.0.1             TCP      65     3950 → 54175 [PSH, ACK] Seq=11 Ack=24 Win=408256 Len=9 TSval=1808742213 TSecr=1808742212
0000  41 44 4d 5f 52 58 5f 4f 4b                        ADM_RX_OK
    460 11.532659      127.0.0.1             127.0.0.1             TCP      62     54175 → 3950 [PSH, ACK] Seq=24 Ack=20 Win=408256 Len=6 TSval=1808742213 TSecr=1808742213
0000  41 32 23 33 2e 33                                 A2#3.3
    462 11.533609      127.0.0.1             127.0.0.1             TCP      65     3950 → 54175 [PSH, ACK] Seq=20 Ack=30 Win=408256 Len=9 TSval=1808742213 TSecr=1808742213
0000  41 44 4d 5f 52 58 5f 4f 4b                        ADM_RX_OK
    464 11.533657      127.0.0.1             127.0.0.1             TCP      62     54175 → 3950 [PSH, ACK] Seq=30 Ack=29 Win=408256 Len=6 TSval=1808742214 TSecr=1808742213
0000  41 33 23 33 2e 37                                 A3#3.7
    466 11.534604      127.0.0.1             127.0.0.1             TCP      65     3950 → 54175 [PSH, ACK] Seq=29 Ack=36 Win=408256 Len=9 TSval=1808742214 TSecr=1808742214
0000  41 44 4d 5f 52 58 5f 4f 4b                        ADM_RX_OK
    468 11.534649      127.0.0.1             127.0.0.1             TCP      62     54175 → 3950 [PSH, ACK] Seq=36 Ack=38 Win=408256 Len=6 TSval=1808742215 TSecr=1808742214
0000  54 58 5f 46 49 4e                                 TX_FIN
    479 11.536764      127.0.0.1             127.0.0.1             TCP      66     3950 → 54176 [PSH, ACK] Seq=1 Ack=18 Win=408256 Len=10 TSval=1808742217 TSecr=1808742212
0000  41 44 4d 5f 49 5f 52 43 47 5a                     ADM_I_RCGZ
    483 11.536812      127.0.0.1             127.0.0.1             TCP      62     54176 → 3950 [PSH, ACK] Seq=18 Ack=11 Win=408288 Len=6 TSval=1808742217 TSecr=1808742217
0000  43 31 23 33 2e 32                                 C1#3.2
    487 11.538067      127.0.0.1             127.0.0.1             TCP      65     3950 → 54176 [PSH, ACK] Seq=11 Ack=24 Win=408256 Len=9 TSval=1808742218 TSecr=1808742217
0000  41 44 4d 5f 52 58 5f 4f 4b                        ADM_RX_OK
    489 11.538139      127.0.0.1             127.0.0.1             TCP      62     54176 → 3950 [PSH, ACK] Seq=24 Ack=20 Win=408256 Len=6 TSval=1808742218 TSecr=1808742218
0000  43 32 23 33 2e 33                                 C2#3.3
    491 11.539229      127.0.0.1             127.0.0.1             TCP      65     3950 → 54176 [PSH, ACK] Seq=20 Ack=30 Win=408256 Len=9 TSval=1808742219 TSecr=1808742218
0000  41 44 4d 5f 52 58 5f 4f 4b                        ADM_RX_OK
    493 11.539278      127.0.0.1             127.0.0.1             TCP      62     54176 → 3950 [PSH, ACK] Seq=30 Ack=29 Win=408256 Len=6 TSval=1808742219 TSecr=1808742219
0000  43 33 23 33 2e 35                                 C3#3.5
    495 11.540212      127.0.0.1             127.0.0.1             TCP      65     3950 → 54176 [PSH, ACK] Seq=29 Ack=36 Win=408256 Len=9 TSval=1808742219 TSecr=1808742219
0000  41 44 4d 5f 52 58 5f 4f 4b                        ADM_RX_OK
    497 11.540257      127.0.0.1             127.0.0.1             TCP      62     54176 → 3950 [PSH, ACK] Seq=36 Ack=38 Win=408256 Len=6 TSval=1808742220 TSecr=1808742219
0000  54 58 5f 46 49 4e                                 TX_FIN
    508 11.541998      127.0.0.1             127.0.0.1             TCP      66     3950 → 54177 [PSH, ACK] Seq=1 Ack=18 Win=408256 Len=10 TSval=1808742221 TSecr=1808742212
0000  41 44 4d 5f 49 5f 52 43 47 5a                     ADM_I_RCGZ
    510 11.542052      127.0.0.1             127.0.0.1             TCP      62     54177 → 3950 [PSH, ACK] Seq=18 Ack=11 Win=408288 Len=6 TSval=1808742221 TSecr=1808742221
0000  42 31 23 34 2e 30                                 B1#4.0
    523 11.543552      127.0.0.1             127.0.0.1             TCP      65     3950 → 54177 [PSH, ACK] Seq=11 Ack=24 Win=408256 Len=9 TSval=1808742223 TSecr=1808742221
0000  41 44 4d 5f 52 58 5f 4f 4b                        ADM_RX_OK
    525 11.543661      127.0.0.1             127.0.0.1             TCP      62     54177 → 3950 [PSH, ACK] Seq=24 Ack=20 Win=408256 Len=6 TSval=1808742223 TSecr=1808742223
0000  42 32 23 33 2e 30                                 B2#3.0
    527 11.544735      127.0.0.1             127.0.0.1             TCP      65     3950 → 54177 [PSH, ACK] Seq=20 Ack=30 Win=408256 Len=9 TSval=1808742224 TSecr=1808742223
0000  41 44 4d 5f 52 58 5f 4f 4b                        ADM_RX_OK
    529 11.544785      127.0.0.1             127.0.0.1             TCP      62     54177 → 3950 [PSH, ACK] Seq=30 Ack=29 Win=408256 Len=6 TSval=1808742224 TSecr=1808742224
0000  42 33 23 34 2e 30                                 B3#4.0
    531 11.545595      127.0.0.1             127.0.0.1             TCP      65     3950 → 54177 [PSH, ACK] Seq=29 Ack=36 Win=408256 Len=9 TSval=1808742224 TSecr=1808742224
0000  41 44 4d 5f 52 58 5f 4f 4b                        ADM_RX_OK
    533 11.545638      127.0.0.1             127.0.0.1             TCP      62     54177 → 3950 [PSH, ACK] Seq=36 Ack=38 Win=408256 Len=6 TSval=1808742224 TSecr=1808742224
0000  54 58 5f 46 49 4e                                 TX_FIN
    776 18.697827      127.0.0.1             127.0.0.1             TCP      70     54182 → 3950 [PSH, ACK] Seq=1 Ack=1 Win=408288 Len=14 TSval=1808749332 TSecr=1808749330

////////////////////////////////////////
////////////////////////////////////////
//                                    //
//    END OF PHASE 1                  //
//                                    //
////////////////////////////////////////
////////////////////////////////////////

0000  49 5f 41 4d 5f 53 54 55 44 45 4e 54 23 32         I_AM_STUDENT#2
    782 18.697935      127.0.0.1             127.0.0.1             TCP      70     54180 → 3950 [PSH, ACK] Seq=1 Ack=1 Win=408288 Len=14 TSval=1808749332 TSecr=1808749330
0000  49 5f 41 4d 5f 53 54 55 44 45 4e 54 23 33         I_AM_STUDENT#3
    784 18.697989      127.0.0.1             127.0.0.1             TCP      70     54181 → 3950 [PSH, ACK] Seq=1 Ack=1 Win=408288 Len=14 TSval=1808749332 TSecr=1808749330
0000  49 5f 41 4d 5f 53 54 55 44 45 4e 54 23 31         I_AM_STUDENT#1
    790 18.698228      127.0.0.1             127.0.0.1             TCP      66     3950 → 54181 [PSH, ACK] Seq=1 Ack=15 Win=408256 Len=10 TSval=1808749332 TSecr=1808749332
0000  41 44 4d 5f 49 5f 52 43 47 5a                     ADM_I_RCGZ
    792 18.698294      127.0.0.1             127.0.0.1             TCP      65     54181 → 3950 [PSH, ACK] Seq=15 Ack=11 Win=408288 Len=9 TSval=1808749332 TSecr=1808749332
0000  31 23 47 50 41 23 33 2e 35                        1#GPA#3.5
    794 18.699691      127.0.0.1             127.0.0.1             TCP      65     3950 → 54181 [PSH, ACK] Seq=11 Ack=24 Win=408256 Len=9 TSval=1808749333 TSecr=1808749332
0000  41 44 4d 5f 52 58 5f 4f 4b                        ADM_RX_OK
    796 18.699751      127.0.0.1             127.0.0.1             TCP      60     54181 → 3950 [PSH, ACK] Seq=24 Ack=20 Win=408256 Len=4 TSval=1808749333 TSecr=1808749333
0000  31 23 41 33                                       1#A3
    798 18.700054      127.0.0.1             127.0.0.1             TCP      70     54184 → 3950 [PSH, ACK] Seq=1 Ack=1 Win=408288 Len=14 TSval=1808749333 TSecr=1808749332
0000  49 5f 41 4d 5f 53 54 55 44 45 4e 54 23 35         I_AM_STUDENT#5
    800 18.700071      127.0.0.1             127.0.0.1             TCP      70     54183 → 3950 [PSH, ACK] Seq=1 Ack=1 Win=408288 Len=14 TSval=1808749333 TSecr=1808749332
0000  49 5f 41 4d 5f 53 54 55 44 45 4e 54 23 34         I_AM_STUDENT#4
    802 18.700746      127.0.0.1             127.0.0.1             TCP      65     3950 → 54181 [PSH, ACK] Seq=20 Ack=28 Win=408256 Len=9 TSval=1808749334 TSecr=1808749333
0000  41 44 4d 5f 52 58 5f 4f 4b                        ADM_RX_OK
    804 18.700790      127.0.0.1             127.0.0.1             TCP      60     54181 → 3950 [PSH, ACK] Seq=28 Ack=29 Win=408256 Len=4 TSval=1808749334 TSecr=1808749334
0000  31 23 41 32                                       1#A2
    806 18.701674      127.0.0.1             127.0.0.1             TCP      65     3950 → 54181 [PSH, ACK] Seq=29 Ack=32 Win=408256 Len=9 TSval=1808749334 TSecr=1808749334
0000  41 44 4d 5f 52 58 5f 4f 4b                        ADM_RX_OK
    808 18.701704      127.0.0.1             127.0.0.1             TCP      60     54181 → 3950 [PSH, ACK] Seq=32 Ack=38 Win=408256 Len=4 TSval=1808749334 TSecr=1808749334
0000  31 23 42 32                                       1#B2
    810 18.702672      127.0.0.1             127.0.0.1             TCP      65     3950 → 54181 [PSH, ACK] Seq=38 Ack=36 Win=408256 Len=9 TSval=1808749335 TSecr=1808749334
0000  41 44 4d 5f 52 58 5f 4f 4b                        ADM_RX_OK
    812 18.702710      127.0.0.1             127.0.0.1             TCP      62     54181 → 3950 [PSH, ACK] Seq=36 Ack=47 Win=408224 Len=6 TSval=1808749335 TSecr=1808749335
0000  54 58 5f 46 49 4e                                 TX_FIN
    814 18.702791      127.0.0.1             127.0.0.1             TCP      61     3950 → 54181 [PSH, ACK] Seq=47 Ack=42 Win=408256 Len=5 TSval=1808749335 TSecr=1808749335
0000  76 61 6c 69 64                                    valid
    825 18.704552      127.0.0.1             127.0.0.1             TCP      66     3950 → 54180 [PSH, ACK] Seq=1 Ack=15 Win=408256 Len=10 TSval=1808749336 TSecr=1808749332
0000  41 44 4d 5f 49 5f 52 43 47 5a                     ADM_I_RCGZ
    827 18.704593      127.0.0.1             127.0.0.1             TCP      65     54180 → 3950 [PSH, ACK] Seq=15 Ack=11 Win=408288 Len=9 TSval=1808749336 TSecr=1808749336
0000  33 23 47 50 41 23 34 2e 30                        3#GPA#4.0
    833 18.705834      127.0.0.1             127.0.0.1             TCP      65     3950 → 54180 [PSH, ACK] Seq=11 Ack=24 Win=408256 Len=9 TSval=1808749338 TSecr=1808749336
0000  41 44 4d 5f 52 58 5f 4f 4b                        ADM_RX_OK
    835 18.705915      127.0.0.1             127.0.0.1             TCP      60     54180 → 3950 [PSH, ACK] Seq=24 Ack=20 Win=408256 Len=4 TSval=1808749338 TSecr=1808749338
0000  33 23 42 31                                       3#B1
    837 18.706976      127.0.0.1             127.0.0.1             TCP      65     3950 → 54180 [PSH, ACK] Seq=20 Ack=28 Win=408256 Len=9 TSval=1808749339 TSecr=1808749338
0000  41 44 4d 5f 52 58 5f 4f 4b                        ADM_RX_OK
    839 18.707012      127.0.0.1             127.0.0.1             TCP      60     54180 → 3950 [PSH, ACK] Seq=28 Ack=29 Win=408256 Len=4 TSval=1808749339 TSecr=1808749339
0000  33 23 43 31                                       3#C1
    841 18.707886      127.0.0.1             127.0.0.1             TCP      65     3950 → 54180 [PSH, ACK] Seq=29 Ack=32 Win=408256 Len=9 TSval=1808749339 TSecr=1808749339
0000  41 44 4d 5f 52 58 5f 4f 4b                        ADM_RX_OK
    843 18.707918      127.0.0.1             127.0.0.1             TCP      60     54180 → 3950 [PSH, ACK] Seq=32 Ack=38 Win=408256 Len=4 TSval=1808749339 TSecr=1808749339
0000  33 23 41 31                                       3#A1
    845 18.708842      127.0.0.1             127.0.0.1             TCP      65     3950 → 54180 [PSH, ACK] Seq=38 Ack=36 Win=408256 Len=9 TSval=1808749340 TSecr=1808749339
0000  41 44 4d 5f 52 58 5f 4f 4b                        ADM_RX_OK
    847 18.708889      127.0.0.1             127.0.0.1             TCP      62     54180 → 3950 [PSH, ACK] Seq=36 Ack=47 Win=408224 Len=6 TSval=1808749340 TSecr=1808749340
0000  54 58 5f 46 49 4e                                 TX_FIN
    849 18.708948      127.0.0.1             127.0.0.1             TCP      61     3950 → 54180 [PSH, ACK] Seq=47 Ack=42 Win=408256 Len=5 TSval=1808749340 TSecr=1808749340
0000  76 61 6c 69 64                                    valid
    860 18.711761      127.0.0.1             127.0.0.1             TCP      66     3950 → 54182 [PSH, ACK] Seq=1 Ack=15 Win=408256 Len=10 TSval=1808749342 TSecr=1808749332
0000  41 44 4d 5f 49 5f 52 43 47 5a                     ADM_I_RCGZ
    864 18.712195      127.0.0.1             127.0.0.1             TCP      65     54182 → 3950 [PSH, ACK] Seq=15 Ack=11 Win=408288 Len=9 TSval=1808749342 TSecr=1808749342
0000  32 23 47 50 41 23 33 2e 37                        2#GPA#3.7
    875 18.715323      127.0.0.1             127.0.0.1             TCP      65     3950 → 54182 [PSH, ACK] Seq=11 Ack=24 Win=408256 Len=9 TSval=1808749345 TSecr=1808749342
0000  41 44 4d 5f 52 58 5f 4f 4b                        ADM_RX_OK
    877 18.716362      127.0.0.1             127.0.0.1             TCP      60     54182 → 3950 [PSH, ACK] Seq=24 Ack=20 Win=408256 Len=4 TSval=1808749346 TSecr=1808749345
0000  32 23 43 32                                       2#C2
    879 18.718002      127.0.0.1             127.0.0.1             TCP      65     3950 → 54182 [PSH, ACK] Seq=20 Ack=28 Win=408256 Len=9 TSval=1808749347 TSecr=1808749346
0000  41 44 4d 5f 52 58 5f 4f 4b                        ADM_RX_OK
    881 18.718120      127.0.0.1             127.0.0.1             TCP      60     54182 → 3950 [PSH, ACK] Seq=28 Ack=29 Win=408256 Len=4 TSval=1808749347 TSecr=1808749347
0000  32 23 43 31                                       2#C1
    883 18.719237      127.0.0.1             127.0.0.1             TCP      65     3950 → 54182 [PSH, ACK] Seq=29 Ack=32 Win=408256 Len=9 TSval=1808749348 TSecr=1808749347
0000  41 44 4d 5f 52 58 5f 4f 4b                        ADM_RX_OK
    885 18.719355      127.0.0.1             127.0.0.1             TCP      60     54182 → 3950 [PSH, ACK] Seq=32 Ack=38 Win=408256 Len=4 TSval=1808749348 TSecr=1808749348
0000  32 23 42 33                                       2#B3
    887 18.720276      127.0.0.1             127.0.0.1             TCP      65     3950 → 54182 [PSH, ACK] Seq=38 Ack=36 Win=408256 Len=9 TSval=1808749349 TSecr=1808749348
0000  41 44 4d 5f 52 58 5f 4f 4b                        ADM_RX_OK
    889 18.720347      127.0.0.1             127.0.0.1             TCP      62     54182 → 3950 [PSH, ACK] Seq=36 Ack=47 Win=408224 Len=6 TSval=1808749349 TSecr=1808749349
0000  54 58 5f 46 49 4e                                 TX_FIN
    891 18.720468      127.0.0.1             127.0.0.1             TCP      61     3950 → 54182 [PSH, ACK] Seq=47 Ack=42 Win=408256 Len=5 TSval=1808749349 TSecr=1808749349
0000  76 61 6c 69 64                                    valid
    902 18.725050      127.0.0.1             127.0.0.1             TCP      66     3950 → 54183 [PSH, ACK] Seq=1 Ack=15 Win=408256 Len=10 TSval=1808749353 TSecr=1808749333
0000  41 44 4d 5f 49 5f 52 43 47 5a                     ADM_I_RCGZ
    904 18.725204      127.0.0.1             127.0.0.1             TCP      65     54183 → 3950 [PSH, ACK] Seq=15 Ack=11 Win=408288 Len=9 TSval=1808749353 TSecr=1808749353
0000  34 23 47 50 41 23 32 2e 39                        4#GPA#2.9
    906 18.726341      127.0.0.1             127.0.0.1             TCP      65     3950 → 54183 [PSH, ACK] Seq=11 Ack=24 Win=408256 Len=9 TSval=1808749354 TSecr=1808749353
0000  41 44 4d 5f 52 58 5f 4f 4b                        ADM_RX_OK
    908 18.726402      127.0.0.1             127.0.0.1             TCP      60     54183 → 3950 [PSH, ACK] Seq=24 Ack=20 Win=408256 Len=4 TSval=1808749354 TSecr=1808749354
0000  34 23 44 31                                       4#D1
    910 18.727497      127.0.0.1             127.0.0.1             TCP      65     3950 → 54183 [PSH, ACK] Seq=20 Ack=28 Win=408256 Len=9 TSval=1808749355 TSecr=1808749354
0000  41 44 4d 5f 52 58 5f 4f 4b                        ADM_RX_OK
    912 18.727536      127.0.0.1             127.0.0.1             TCP      60     54183 → 3950 [PSH, ACK] Seq=28 Ack=29 Win=408256 Len=4 TSval=1808749355 TSecr=1808749355
0000  34 23 42 31                                       4#B1
    914 18.728676      127.0.0.1             127.0.0.1             TCP      65     3950 → 54183 [PSH, ACK] Seq=29 Ack=32 Win=408256 Len=9 TSval=1808749356 TSecr=1808749355
0000  41 44 4d 5f 52 58 5f 4f 4b                        ADM_RX_OK
    916 18.728725      127.0.0.1             127.0.0.1             TCP      60     54183 → 3950 [PSH, ACK] Seq=32 Ack=38 Win=408256 Len=4 TSval=1808749356 TSecr=1808749356
0000  34 23 42 32                                       4#B2
    918 18.729578      127.0.0.1             127.0.0.1             TCP      65     3950 → 54183 [PSH, ACK] Seq=38 Ack=36 Win=408256 Len=9 TSval=1808749356 TSecr=1808749356
0000  41 44 4d 5f 52 58 5f 4f 4b                        ADM_RX_OK
    920 18.729619      127.0.0.1             127.0.0.1             TCP      62     54183 → 3950 [PSH, ACK] Seq=36 Ack=47 Win=408224 Len=6 TSval=1808749356 TSecr=1808749356
0000  54 58 5f 46 49 4e                                 TX_FIN
    922 18.729694      127.0.0.1             127.0.0.1             TCP      61     3950 → 54183 [PSH, ACK] Seq=47 Ack=42 Win=408256 Len=5 TSval=1808749357 TSecr=1808749356
0000  76 61 6c 69 64                                    valid
    933 18.732342      127.0.0.1             127.0.0.1             TCP      66     3950 → 54184 [PSH, ACK] Seq=1 Ack=15 Win=408256 Len=10 TSval=1808749359 TSecr=1808749333
0000  41 44 4d 5f 49 5f 52 43 47 5a                     ADM_I_RCGZ
    935 18.732394      127.0.0.1             127.0.0.1             TCP      65     54184 → 3950 [PSH, ACK] Seq=15 Ack=11 Win=408288 Len=9 TSval=1808749359 TSecr=1808749359
0000  35 23 47 50 41 23 34 2e 30                        5#GPA#4.0
    937 18.733743      127.0.0.1             127.0.0.1             TCP      65     3950 → 54184 [PSH, ACK] Seq=11 Ack=24 Win=408256 Len=9 TSval=1808749360 TSecr=1808749359
0000  41 44 4d 5f 52 58 5f 4f 4b                        ADM_RX_OK
    939 18.733791      127.0.0.1             127.0.0.1             TCP      60     54184 → 3950 [PSH, ACK] Seq=24 Ack=20 Win=408256 Len=4 TSval=1808749360 TSecr=1808749360
0000  35 23 41 34                                       5#A4
    941 18.735163      127.0.0.1             127.0.0.1             TCP      65     3950 → 54184 [PSH, ACK] Seq=20 Ack=28 Win=408256 Len=9 TSval=1808749361 TSecr=1808749360
0000  41 44 4d 5f 52 58 5f 4f 4b                        ADM_RX_OK
    943 18.735205      127.0.0.1             127.0.0.1             TCP      60     54184 → 3950 [PSH, ACK] Seq=28 Ack=29 Win=408256 Len=4 TSval=1808749361 TSecr=1808749361
0000  35 23 41 35                                       5#A5
    945 18.736214      127.0.0.1             127.0.0.1             TCP      65     3950 → 54184 [PSH, ACK] Seq=29 Ack=32 Win=408256 Len=9 TSval=1808749362 TSecr=1808749361
0000  41 44 4d 5f 52 58 5f 4f 4b                        ADM_RX_OK
    947 18.736256      127.0.0.1             127.0.0.1             TCP      62     54184 → 3950 [PSH, ACK] Seq=32 Ack=38 Win=408256 Len=6 TSval=1808749362 TSecr=1808749362
0000  54 58 5f 46 49 4e                                 TX_FIN
    949 18.736357      127.0.0.1             127.0.0.1             TCP      57     3950 → 54184 [PSH, ACK] Seq=38 Ack=38 Win=408256 Len=1 TSval=1808749362 TSecr=1808749362
0000  30                                                0
    960 18.739802      127.0.0.1             127.0.0.1             UDP      53     55074 → 22050  Len=21
0000  41 63 63 65 70 74 23 41 32 23 64 65 70 61 72 74   Accept#A2#depart
0010  6d 65 6e 74 41                                    mentA
    961 18.739834      127.0.0.1             127.0.0.1             UDP      39     55074 → 22050  Len=7
0000  41 44 4d 5f 45 4e 44                              ADM_END
    962 18.743634      127.0.0.1             127.0.0.1             UDP      53     59674 → 22150  Len=21
0000  41 63 63 65 70 74 23 43 32 23 64 65 70 61 72 74   Accept#C2#depart
0010  6d 65 6e 74 43                                    mentC
    963 18.743664      127.0.0.1             127.0.0.1             UDP      39     59674 → 22150  Len=7
0000  41 44 4d 5f 45 4e 44                              ADM_END
    964 18.747873      127.0.0.1             127.0.0.1             UDP      53     55020 → 22250  Len=21
0000  41 63 63 65 70 74 23 42 31 23 64 65 70 61 72 74   Accept#B1#depart
0010  6d 65 6e 74 42                                    mentB
    965 18.747990      127.0.0.1             127.0.0.1             UDP      39     55020 → 22250  Len=7
0000  41 44 4d 5f 45 4e 44                              ADM_END
    966 18.751850      127.0.0.1             127.0.0.1             UDP      38     50227 → 22350  Len=6
0000  52 65 6a 65 63 74                                 Reject
    967 18.751924      127.0.0.1             127.0.0.1             UDP      39     50227 → 22350  Len=7
0000  41 44 4d 5f 45 4e 44                              ADM_END
    968 18.757736      127.0.0.1             127.0.0.1             UDP      47     53910 → 21750  Len=15
0000  53 74 75 64 65 6e 74 31 23 33 2e 35 23 41 32      Student1#3.5#A2
    969 18.760005      127.0.0.1             127.0.0.1             UDP      39     53910 → 21750  Len=7
0000  41 44 4d 5f 45 4e 44                              ADM_END
    970 18.763478      127.0.0.1             127.0.0.1             UDP      47     52087 → 21850  Len=15
0000  53 74 75 64 65 6e 74 33 23 34 2e 30 23 42 31      Student3#4.0#B1
    971 18.769095      127.0.0.1             127.0.0.1             UDP      39     52087 → 21850  Len=7
0000  41 44 4d 5f 45 4e 44                              ADM_END
    972 18.773756      127.0.0.1             127.0.0.1             UDP      47     50302 → 21950  Len=15
0000  53 74 75 64 65 6e 74 32 23 33 2e 37 23 43 32      Student2#3.7#C2
    973 18.779729      127.0.0.1             127.0.0.1             UDP      39     50302 → 21950  Len=7
0000  41 44 4d 5f 45 4e 44                              ADM_END
